{
  "eventId": "c3d4e5f6-a7b8-4901-8cde-3456789012cd",
  "eventType": "LancamentoRegistrado",
  "schemaVersion": 1,
  "occurredAt": "2026-10-23T03:10:00Z",
  "comercianteId": "0f8fad5b-d9cb-469f-a165-70867728950e",
  "lancamentoId": "d4e5f6a7-b8c9-4012-9def-4567890123de",
  "tipo": "ESTORNO",
  "valor": "150.75",
  "dataReferencia": "2026-10-23",
  "tipoOriginal": "CREDITO",
  "referenciaLancamentoId": "b2c3d4e5-f6a7-4890-9bcd-2345678901bc",
  "traceId": "4bf92f3577b34da6a3ce929d0e0e4736"
}
